{
  "meta": {
    "extensionId": "eurocheck",
    "extensionName": "EuroCheck - EU Price Comparison",
    "createdAt": "2026-01-30T00:00:00Z",
    "lastUpdated": "2026-01-30T05:00:00Z",
    "schemaVersion": "1.0.0"
  },
  "daily": [],
  "usage": [],
  "competitors": [],
  "traffic": [],
  "growth": [],
  "alerts": [
    {
      "name": "User Drop Alert",
      "metric": "chrome.users",
      "condition": "change_below",
      "threshold": -10,
      "channel": "telegram",
      "enabled": true
    },
    {
      "name": "Rating Drop Alert",
      "metric": "chrome.rating",
      "condition": "below",
      "threshold": 4.0,
      "channel": "telegram",
      "enabled": true
    },
    {
      "name": "New Review Alert",
      "metric": "chrome.reviewCount",
      "condition": "change_above",
      "threshold": 0,
      "channel": "telegram",
      "enabled": true
    },
    {
      "name": "Install Milestone",
      "metric": "totals.totalInstalls",
      "condition": "above",
      "threshold": 1000,
      "channel": "telegram",
      "enabled": true
    }
  ]
}
